--
-- Test cases for ZHeap
--
set client_min_messages = warning;
--
-- 1. Test for storage engine
--
-- Normal heap
CREATE TABLE t1_heap
(
 a int
);
\d+ t1_heap;
                                  Table "public.t1_heap"
 Column |  Type   | Collation | Nullable | Default | Storage | Stats target | Description 
--------+---------+-----------+----------+---------+---------+--------------+-------------
 a      | integer |           |          |         | plain   |              | 

-- Zheap heap
CREATE TABLE t1_zheap
(
 a int
) USING zheap;
\d+ t1_zheap;
                                 Table "public.t1_zheap"
 Column |  Type   | Collation | Nullable | Default | Storage | Stats target | Description 
--------+---------+-----------+----------+---------+---------+--------------+-------------
 a      | integer |           |          |         | plain   |              | 

DROP TABLE t1_heap;
DROP TABLE t1_zheap;
--
-- 2. Test for Index Scan on zheap
--
set enable_seqscan to false;
set enable_indexonlyscan to false;
set enable_indexscan to true;
set enable_bitmapscan to false;
create table btree_zheap_tbl(id int4, t text) USING zheap WITH (autovacuum_enabled=false) ;
insert into btree_zheap_tbl
  select g, g::text || '_' ||
            (select string_agg(md5(i::text), '_') from generate_series(1, 50) i)
			from generate_series(1, 100) g;
create index btree_zheap_idx on btree_zheap_tbl (id);
-- check the plan with index scan
explain (costs false) select * from btree_zheap_tbl where id=1;
                     QUERY PLAN                      
-----------------------------------------------------
 Index Scan using btree_zheap_idx on btree_zheap_tbl
   Index Cond: (id = 1)
(2 rows)

select id from btree_zheap_tbl where id=1;
 id 
----
  1
(1 row)

-- update a non-key column and delete a row
update btree_zheap_tbl set t='modified' where id=1;
select * from btree_zheap_tbl where id = 1;
 id |    t     
----+----------
  1 | modified
(1 row)

delete from btree_zheap_tbl where id=2;
select * from btree_zheap_tbl where id = 2;
 id | t 
----+---
(0 rows)

drop table btree_zheap_tbl;
--
--3. Test for aggregate nodes
--
CREATE TABLE aggtest_zheap
(
 a int,
 b int
) USING zheap;
INSERT INTO aggtest_zheap SELECT g,g FROM generate_series(1,1000) g;
SELECT sum(a) AS sum_198 FROM aggtest_zheap;
 sum_198 
---------
  500500
(1 row)

SELECT max(aggtest_zheap.a) AS max_3 FROM aggtest_zheap;
 max_3 
-------
  1000
(1 row)

SELECT stddev_pop(b) FROM aggtest_zheap;
    stddev_pop    
------------------
 288.674990257210
(1 row)

SELECT stddev_samp(b) FROM aggtest_zheap;
   stddev_samp    
------------------
 288.819436095749
(1 row)

SELECT var_pop(b) FROM aggtest_zheap;
      var_pop       
--------------------
 83333.250000000000
(1 row)

SELECT var_samp(b) FROM aggtest_zheap;
      var_samp      
--------------------
 83416.666666666667
(1 row)

SELECT stddev_pop(b::numeric) FROM aggtest_zheap;
    stddev_pop    
------------------
 288.674990257210
(1 row)

SELECT stddev_samp(b::numeric) FROM aggtest_zheap;
   stddev_samp    
------------------
 288.819436095749
(1 row)

SELECT var_pop(b::numeric) FROM aggtest_zheap;
      var_pop       
--------------------
 83333.250000000000
(1 row)

SELECT var_samp(b::numeric) FROM aggtest_zheap;
      var_samp      
--------------------
 83416.666666666667
(1 row)

DROP TABLE aggtest_zheap;
set client_min_messages = notice;
--
--4. Test for PRIMARY KEY on zheap tables.
--
CREATE TABLE pkey_test_zheap
(
 a int PRIMARY KEY,
 b int
) USING zheap;
-- should run suucessfully.
INSERT INTO pkey_test_zheap VALUES (10, 30);
-- should error out, primary key doesn't allow NULL value.
INSERT INTO pkey_test_zheap(b) VALUES (30);
ERROR:  null value in column "a" violates not-null constraint
DETAIL:  Failing row contains (null, 30).
-- should error out, primary key doesn't allow duplicate value.
INSERT INTO pkey_test_zheap VALUES (10, 30);
ERROR:  duplicate key value violates unique constraint "pkey_test_zheap_pkey"
DETAIL:  Key (a)=(10) already exists.
SELECT * FROM pkey_test_zheap;
 a  | b  
----+----
 10 | 30
(1 row)

DROP TABLE pkey_test_zheap;
--
-- 5.1. Test of non-inlace-update where new update goes to new page.
--
CREATE TABLE update_test_zheap(c1 int,c2 char(1000),c3 varchar(10));
INSERT INTO update_test_zheap VALUES(generate_series(1,7), 'aaa', 'aaa');
UPDATE update_test_zheap SET c3 = 'bbbb' WHERE c1=1;
-- verify the update
SELECT c3 FROM update_test_zheap WHERE c1=1;
  c3  
------
 bbbb
(1 row)

DROP TABLE update_test_zheap;
--
-- 5.2. Test of non-inlace-update on same page and for index key updates.
--
set enable_indexonlyscan to false;
set enable_bitmapscan to false;
CREATE TABLE update_test_zheap(c1 int PRIMARY KEY, c2 int);
INSERT INTO update_test_zheap VALUES(generate_series(1,7), 1);
UPDATE update_test_zheap SET c2 = 100 WHERE c1 = 1;
UPDATE update_test_zheap SET c2 = 101 WHERE c1 = 2;
-- verify the update
SELECT c2 FROM update_test_zheap WHERE c1 IN (1,2);
 c2  
-----
 100
 101
(2 rows)

DROP TABLE update_test_zheap;
--
-- 6. Test for bitmap heap scan - taken from bitmapops.sql
--
CREATE TABLE bmscantest (a int, b int, t text) USING zheap;
INSERT INTO bmscantest
  SELECT (r%53), (r%59), 'foooooooooooooooooooooooooooooooooooooooooooooooooooooooooooooooooooooooooooooooooooooooooooooooooooooooooo'
  FROM generate_series(1,70000) r;
CREATE INDEX i_bmtest_a ON bmscantest(a);
CREATE INDEX i_bmtest_b ON bmscantest(b);
-- We want to use bitmapscans. With default settings, the planner currently
-- chooses a bitmap scan for the queries below anyway, but let's make sure.
set enable_indexscan=false;
set enable_seqscan=false;
-- Lower work_mem to trigger use of lossy bitmaps
set work_mem = 64;
-- Test bitmap-and.
SELECT count(*) FROM bmscantest WHERE a = 1 AND b = 1;
 count 
-------
    23
(1 row)

-- Test bitmap-or.
SELECT count(*) FROM bmscantest WHERE a = 1 OR b = 1;
 count 
-------
  2485
(1 row)

-- clean up
DROP TABLE bmscantest;
--
-- 7. Test page pruning after a non-inplace-update
--
CREATE TABLE update_test_zheap(c1 int,c2 char(1000),c3 varchar(10))
							   USING zheap;
INSERT INTO update_test_zheap VALUES(generate_series(1,7), 'aaa', 'aaa');
UPDATE update_test_zheap SET c3 = 'bbbbb' WHERE c1=1;
SELECT c1 from update_test_zheap ORDER BY c1;
 c1 
----
  1
  2
  3
  4
  5
  6
  7
(7 rows)

UPDATE update_test_zheap SET c3 = 'bbbbb' WHERE c1 = 2;
-- record c1 = 2 should come before c1 = 1 because prune should have
-- reclaimed space of moved c1 = 1 and hence new c1 = 2 will be inserted
-- in same page.
SELECT c1 from update_test_zheap ORDER BY c1;
 c1 
----
  1
  2
  3
  4
  5
  6
  7
(7 rows)

-- update last record c1 = 2 such that it can be inplace extended.
UPDATE update_test_zheap SET c3 = 'cccccc' WHERE c1 = 2;
SELECT c1 from update_test_zheap ORDER BY c1;
 c1 
----
  1
  2
  3
  4
  5
  6
  7
(7 rows)

-- update another record in the page to force pruning.
UPDATE update_test_zheap SET c3 = 'bbbbb' WHERE c1 = 7;
SELECT c1 from update_test_zheap ORDER BY c1;
 c1 
----
  1
  2
  3
  4
  5
  6
  7
(7 rows)

DROP TABLE update_test_zheap;
--
-- 8. verify basic cursor fetch.
--
CREATE TABLE cursor_zheap
(
	a int
) USING zheap;
INSERT INTO cursor_zheap SELECT * FROM generate_series(1, 5);
SELECT * FROM cursor_zheap;
 a 
---
 1
 2
 3
 4
 5
(5 rows)

BEGIN;
	DECLARE cur1 SCROLL CURSOR FOR SELECT * FROM cursor_zheap;
	FETCH 2 in cur1;
 a 
---
 1
 2
(2 rows)

	FETCH BACKWARD 2 in cur1;
 a 
---
 1
(1 row)

END;
CREATE MATERIALIZED VIEW mvtest_mv AS SELECT * FROM cursor_zheap;
DROP MATERIALIZED VIEW mvtest_mv;
DROP TABLE cursor_zheap;
-------------------------------------------
-- Test cases for commit/rollback in SPI --
-------------------------------------------
CREATE TABLE test1 (a int, b text) USING zheap;
CREATE TABLE test2 (x int);
INSERT INTO test2 VALUES (0), (1), (2), (3), (4);
TRUNCATE test1;
DO LANGUAGE plpgsql $$
DECLARE
    r RECORD;
BEGIN
    FOR r IN SELECT * FROM test2 ORDER BY x LOOP
        INSERT INTO test1 (a) VALUES (r.x);
        COMMIT;
    END LOOP;
END;
$$;
SELECT * FROM test1 order by a, b;
 a | b 
---+---
 0 | 
 1 | 
 2 | 
 3 | 
 4 | 
(5 rows)

-- error in cursor loop with commit
TRUNCATE test1;
DO LANGUAGE plpgsql $$
DECLARE
    r RECORD;
BEGIN
    FOR r IN SELECT * FROM test2 ORDER BY x LOOP
        INSERT INTO test1 (a) VALUES (12/(r.x-2));
        COMMIT;
    END LOOP;
END;
$$;
ERROR:  division by zero
CONTEXT:  SQL statement "INSERT INTO test1 (a) VALUES (12/(r.x-2))"
PL/pgSQL function inline_code_block line 6 at SQL statement
SELECT * FROM test1 order by a, b;
  a  | b 
-----+---
 -12 | 
  -6 | 
(2 rows)

-- rollback inside cursor loop
TRUNCATE test1;
DO LANGUAGE plpgsql $$
DECLARE
    r RECORD;
BEGIN
    FOR r IN SELECT * FROM test2 ORDER BY x LOOP
        INSERT INTO test1 (a) VALUES (r.x);
        ROLLBACK;
    END LOOP;
END;
$$;
SELECT * FROM test1 order by a, b;
 a | b 
---+---
(0 rows)

-- first commit then rollback inside cursor loop
TRUNCATE test1;
DO LANGUAGE plpgsql $$
DECLARE
    r RECORD;
BEGIN
    FOR r IN SELECT * FROM test2 ORDER BY x LOOP
        INSERT INTO test1 (a) VALUES (r.x);
        IF r.x % 2 = 0 THEN
            COMMIT;
        ELSE
            ROLLBACK;
        END IF;
    END LOOP;
END;
$$;
SELECT * FROM test1 order by a, b;
 a | b 
---+---
 0 | 
 2 | 
 4 | 
(3 rows)

SELECT * FROM pg_cursors;
 name | statement | is_holdable | is_binary | is_scrollable | creation_time 
------+-----------+-------------+-----------+---------------+---------------
(0 rows)

-- commit/rollback with begin exception case
-- should throw error
TRUNCATE test1;
DO LANGUAGE plpgsql $$
DECLARE
    r RECORD;
BEGIN
    FOR r IN SELECT * FROM test2 ORDER BY x LOOP
        INSERT INTO test1 (a) VALUES (r.x);
        IF r.x % 2 = 0 THEN
            COMMIT;
        ELSE
            ROLLBACK;
        END IF;
    END LOOP;
EXCEPTION WHEN OTHERS THEN
	RAISE NOTICE '% %', SQLERRM, SQLSTATE;
END;
$$;
NOTICE:  cannot commit while a subtransaction is active 2D000
SELECT * FROM test1 order by a, b;
 a | b 
---+---
(0 rows)

SELECT * FROM test2 order by x;
 x 
---
 0
 1
 2
 3
 4
(5 rows)

DROP TABLE test1;
DROP TABLE test2;
-- rollback of toast table insertion
CREATE TABLE ctoast (key int primary key, val text) USING zheap;
CREATE OR REPLACE FUNCTION ctoast_large_val() RETURNS TEXT LANGUAGE SQL AS
'select array_agg(md5(g::text))::text from generate_series(1, 256) g';
BEGIN;
INSERT INTO ctoast (key, val) VALUES (1, ctoast_large_val());
ROLLBACK;
DROP TABLE ctoast;
DROP FUNCTION ctoast_large_val;
-- check that new relations have no relfrozenxid/relminmxid and that
-- that's not changed by VACUUM, VACUUM FULL and CLUSTER
-- new relation
CREATE TABLE testvacuum(id serial) USING zheap;
SELECT relfrozenxid, relminmxid FROM pg_class WHERE oid = 'testvacuum'::regclass;
 relfrozenxid | relminmxid 
--------------+------------
            0 |          0
(1 row)

INSERT INTO testvacuum DEFAULT VALUES;
SELECT relfrozenxid, relminmxid FROM pg_class WHERE oid = 'testvacuum'::regclass;
 relfrozenxid | relminmxid 
--------------+------------
            0 |          0
(1 row)

-- plain VACUUM
VACUUM testvacuum;
SELECT relfrozenxid, relminmxid FROM pg_class WHERE oid = 'testvacuum'::regclass;
 relfrozenxid | relminmxid 
--------------+------------
            0 |          0
(1 row)

-- VACUUM FULL
VACUUM FULL testvacuum;
SELECT relfrozenxid, relminmxid FROM pg_class WHERE oid = 'testvacuum'::regclass;
 relfrozenxid | relminmxid 
--------------+------------
            0 |          0
(1 row)

-- CLUSTER
CREATE INDEX testvacuum_id ON testvacuum(id);
CLUSTER testvacuum USING testvacuum_id;
SELECT relfrozenxid, relminmxid FROM pg_class WHERE oid = 'testvacuum'::regclass;
 relfrozenxid | relminmxid 
--------------+------------
            0 |          0
(1 row)

-- and that there's still content after this ordeal
SELECT * FROM testvacuum ORDER BY id;
 id 
----
  1
(1 row)

